{
  "schema": "saccade.public-truth-cases/1",
  "generated_from": [
    "catalog/truth_inventory.json",
    "catalog/external_cases.json",
    "catalog/control_denominator_sources.json"
  ],
  "source_documents": [
    {
      "id": "truth_inventory",
      "status": "merged",
      "reason": "canonical 34 role, 12 variant, and 6 boundary inventory"
    },
    {
      "id": "legacy_lifecycle_gauntlet_reference",
      "status": "merged",
      "reason": "lifecycle scenarios recorded by the current architecture documents"
    },
    {
      "id": "standards_mainstream_uncommon_controls",
      "status": "merged",
      "reason": "WHATWG HTML, WAI-ARIA roles, and ARIA APG replace the unavailable historical document"
    }
  ],
  "outcomes": [
    "pass",
    "truthful_limitation",
    "unsupported",
    "blocked"
  ],
  "summary": {
    "roles": 34,
    "variants": 12,
    "boundaries": 6,
    "lifecycle_scenarios": 11,
    "total": 63
  },
  "items": [
    {
      "id": "role:button",
      "kind": "role",
      "target": "button",
      "classification": "mainstream_control",
      "sources": [
        {
          "name": "WHATWG HTML — Forms",
          "url": "https://html.spec.whatwg.org/multipage/forms.html",
          "status": "primary_standard"
        },
        {
          "name": "W3C WAI-ARIA 1.2 — Role definitions",
          "url": "https://www.w3.org/TR/wai-aria-1.2/#role_definitions",
          "status": "primary_standard"
        },
        {
          "name": "W3C ARIA Authoring Practices Guide — Patterns",
          "url": "https://www.w3.org/WAI/ARIA/apg/patterns/",
          "status": "official_implementation_guidance"
        }
      ],
      "implementations": [],
      "expected_initial": "truthful role/state/identity projection or declared limitation",
      "expected_transition": "Extension-produced appeared/updated/disappeared delta when the page changes",
      "expected_limitation": "",
      "browsers": [
        "chrome",
        "edge"
      ],
      "pass_criteria": "two independent public sources and a truthful initial view plus externally caused semantic delta",
      "outcome": "blocked",
      "reason": "standards_denominator_merged; public_runtime_evidence_pending; historical_reference_evidence_requires_core_revalidation"
    },
    {
      "id": "role:link",
      "kind": "role",
      "target": "link",
      "classification": "mainstream_control",
      "sources": [
        {
          "name": "WHATWG HTML — Forms",
          "url": "https://html.spec.whatwg.org/multipage/forms.html",
          "status": "primary_standard"
        },
        {
          "name": "W3C WAI-ARIA 1.2 — Role definitions",
          "url": "https://www.w3.org/TR/wai-aria-1.2/#role_definitions",
          "status": "primary_standard"
        },
        {
          "name": "W3C ARIA Authoring Practices Guide — Patterns",
          "url": "https://www.w3.org/WAI/ARIA/apg/patterns/",
          "status": "official_implementation_guidance"
        }
      ],
      "implementations": [],
      "expected_initial": "truthful role/state/identity projection or declared limitation",
      "expected_transition": "Extension-produced appeared/updated/disappeared delta when the page changes",
      "expected_limitation": "",
      "browsers": [
        "chrome",
        "edge"
      ],
      "pass_criteria": "two independent public sources and a truthful initial view plus externally caused semantic delta",
      "outcome": "blocked",
      "reason": "standards_denominator_merged; public_runtime_evidence_pending; historical_reference_evidence_requires_core_revalidation"
    },
    {
      "id": "role:text_field",
      "kind": "role",
      "target": "text_field",
      "classification": "mainstream_control",
      "sources": [
        {
          "name": "WHATWG HTML — Forms",
          "url": "https://html.spec.whatwg.org/multipage/forms.html",
          "status": "primary_standard"
        },
        {
          "name": "W3C WAI-ARIA 1.2 — Role definitions",
          "url": "https://www.w3.org/TR/wai-aria-1.2/#role_definitions",
          "status": "primary_standard"
        },
        {
          "name": "W3C ARIA Authoring Practices Guide — Patterns",
          "url": "https://www.w3.org/WAI/ARIA/apg/patterns/",
          "status": "official_implementation_guidance"
        },
        {
          "name": "Selenium",
          "url": "https://www.selenium.dev/selenium/web/web-form.html",
          "status": "historical_reference_only"
        }
      ],
      "implementations": [
        "native_html"
      ],
      "expected_initial": "truthful role/state/identity projection or declared limitation",
      "expected_transition": "Extension-produced appeared/updated/disappeared delta when the page changes",
      "expected_limitation": "",
      "browsers": [
        "chrome",
        "edge"
      ],
      "pass_criteria": "two independent public sources and a truthful initial view plus externally caused semantic delta",
      "outcome": "blocked",
      "reason": "standards_denominator_merged; public_runtime_evidence_pending; historical_reference_evidence_requires_core_revalidation"
    },
    {
      "id": "role:search_field",
      "kind": "role",
      "target": "search_field",
      "classification": "mainstream_control",
      "sources": [
        {
          "name": "WHATWG HTML — Forms",
          "url": "https://html.spec.whatwg.org/multipage/forms.html",
          "status": "primary_standard"
        },
        {
          "name": "W3C WAI-ARIA 1.2 — Role definitions",
          "url": "https://www.w3.org/TR/wai-aria-1.2/#role_definitions",
          "status": "primary_standard"
        },
        {
          "name": "W3C ARIA Authoring Practices Guide — Patterns",
          "url": "https://www.w3.org/WAI/ARIA/apg/patterns/",
          "status": "official_implementation_guidance"
        }
      ],
      "implementations": [],
      "expected_initial": "truthful role/state/identity projection or declared limitation",
      "expected_transition": "Extension-produced appeared/updated/disappeared delta when the page changes",
      "expected_limitation": "",
      "browsers": [
        "chrome",
        "edge"
      ],
      "pass_criteria": "two independent public sources and a truthful initial view plus externally caused semantic delta",
      "outcome": "blocked",
      "reason": "standards_denominator_merged; public_runtime_evidence_pending; historical_reference_evidence_requires_core_revalidation"
    },
    {
      "id": "role:text_area",
      "kind": "role",
      "target": "text_area",
      "classification": "mainstream_control",
      "sources": [
        {
          "name": "WHATWG HTML — Forms",
          "url": "https://html.spec.whatwg.org/multipage/forms.html",
          "status": "primary_standard"
        },
        {
          "name": "W3C WAI-ARIA 1.2 — Role definitions",
          "url": "https://www.w3.org/TR/wai-aria-1.2/#role_definitions",
          "status": "primary_standard"
        },
        {
          "name": "W3C ARIA Authoring Practices Guide — Patterns",
          "url": "https://www.w3.org/WAI/ARIA/apg/patterns/",
          "status": "official_implementation_guidance"
        },
        {
          "name": "Selenium",
          "url": "https://www.selenium.dev/selenium/web/web-form.html",
          "status": "historical_reference_only"
        }
      ],
      "implementations": [
        "native_html"
      ],
      "expected_initial": "truthful role/state/identity projection or declared limitation",
      "expected_transition": "Extension-produced appeared/updated/disappeared delta when the page changes",
      "expected_limitation": "",
      "browsers": [
        "chrome",
        "edge"
      ],
      "pass_criteria": "two independent public sources and a truthful initial view plus externally caused semantic delta",
      "outcome": "blocked",
      "reason": "standards_denominator_merged; public_runtime_evidence_pending; historical_reference_evidence_requires_core_revalidation"
    },
    {
      "id": "role:content_editable",
      "kind": "role",
      "target": "content_editable",
      "classification": "mainstream_control",
      "sources": [
        {
          "name": "WHATWG HTML — Forms",
          "url": "https://html.spec.whatwg.org/multipage/forms.html",
          "status": "primary_standard"
        },
        {
          "name": "W3C WAI-ARIA 1.2 — Role definitions",
          "url": "https://www.w3.org/TR/wai-aria-1.2/#role_definitions",
          "status": "primary_standard"
        },
        {
          "name": "W3C ARIA Authoring Practices Guide — Patterns",
          "url": "https://www.w3.org/WAI/ARIA/apg/patterns/",
          "status": "official_implementation_guidance"
        }
      ],
      "implementations": [],
      "expected_initial": "truthful role/state/identity projection or declared limitation",
      "expected_transition": "Extension-produced appeared/updated/disappeared delta when the page changes",
      "expected_limitation": "",
      "browsers": [
        "chrome",
        "edge"
      ],
      "pass_criteria": "two independent public sources and a truthful initial view plus externally caused semantic delta",
      "outcome": "blocked",
      "reason": "standards_denominator_merged; public_runtime_evidence_pending; historical_reference_evidence_requires_core_revalidation"
    },
    {
      "id": "role:checkbox",
      "kind": "role",
      "target": "checkbox",
      "classification": "mainstream_control",
      "sources": [
        {
          "name": "WHATWG HTML — Forms",
          "url": "https://html.spec.whatwg.org/multipage/forms.html",
          "status": "primary_standard"
        },
        {
          "name": "W3C WAI-ARIA 1.2 — Role definitions",
          "url": "https://www.w3.org/TR/wai-aria-1.2/#role_definitions",
          "status": "primary_standard"
        },
        {